### ISSUE TITLE
Bcm 53.xx | Asus RT-AC88U | Vlan not working

### ISSUE THREAD

**Issue by stevob99** [openwrt/openwrt#20493]
### Describe the bug

Hi,
I’m wanted to use VLANS on my Asus RT-AC88U and found out, that VLANs are not working at all on this specific device.
So my questions are all BCM55xx devices are affected?

I have tested multiple router of the Asus RT-AC88U all with same issue. (I tested the same configuration on same TP-Link Routers, which is working fine.)
You can see that telegram are send out of the interface for ARP requests, but nothing is received (RX: 0B) 

All Version of OpenWrt are affected.

### OpenWrt version

r28739-d9340319c6

### OpenWrt release

24.10.2

### OpenWrt target/subtarget

bcm53xx/generic

### Device

Asus RT-AC88U

### Image kind

Official downloaded image

### Steps to reproduce

VLAN not working at all

### Actual behaviour

It’s pretty strange the network device with the vlan port is sending (TX) but not receiving (RX) data.

### Diffconfig

```text

```

### Terms

- [x] I am reporting an issue for OpenWrt, not an unsupported fork.

**Comment by stevob99** [comment]
```

5: enp5s0f0.10@enp5s0f0: <BROADCAST,MULTICAST,UP,LOWER_UP> mtu 1500 qdisc noqueue state UP group default qlen 1000
    link/ether 80:61:5f:0e:89:58 brd ff:ff:ff:ff:ff:ff
    inet 192.168.10.13/24 scope global enp5s0f0.10
       valid_lft forever preferred_lft forever
    inet6 fe80::8261:5fff:fe0e:8958/64 scope link

sudo tcpdump -i enp5s0f0.10
tcpdump: verbose output suppressed, use -v[v]... for full protocol decode
listening on enp5s0f0.10, link-type EN10MB (Ethernet), snapshot length 262144 bytes


02:00:13.210716 ARP, Request who-has Mint-PC tell 192.168.10.1, length 46
02:00:13.210734 ARP, Reply Mint-PC is-at 80:61:5f:0e:89:58 (oui Unknown), length 28
02:00:14.238862 ARP, Request who-has Mint-PC tell 192.168.10.1, length 46
02:00:14.238875 ARP, Reply Mint-PC is-at 80:61:5f:0e:89:58 (oui Unknown), length 28
02:00:15.278838 ARP, Request who-has Mint-PC tell 192.168.10.1, length 46
02:00:15.278855 ARP, Reply Mint-PC is-at 80:61:5f:0e:89:58 (oui Unknown), length 28

```

**Comment by stevob99** [comment]
I implemented ‘Open vSwitch’ and found out that the same issue occurs here.
Because Open vSwitch is operating entirety in the Linux userspace, the issue must be related to the Ethernet chip setup.
