### ISSUE TITLE
Wireless devices on the "Dumb AP" cannot communicate with wired devices in the "main router" and vice versa

### ISSUE THREAD

**Issue by rscarvalho90** [openwrt/openwrt#23700]
### Describe the bug

I have this Cudy WR3000 v1 running version 25.12.4 of OpenWRT that acts as "Dumb AP" and is cable connected with a Xiaomi Redmi Router AX6000 (Main Router) running the same version of OpenWRT.

Obs. 1: They are using 802.11r fast transition (plus 802.11k and 802.11v) with WPA2-PSK as encryption method with DAWN activated.
Obs. 2: The related error started after updated from version 24.10.4 to 25.12.4. Before this, they were working perfectly.

# **The Error**

I have a Pi-hole instance running in a device connected via cable into the Main Router. Devices connected via wireless in the Dumb AP cannot connect with the announced DNS IP (192.168.1.19). I've tried to ping this device and another one that was cable connected with the main router and the response was address unreachable. Tried the opposite way, pinging the devices wireless connected in the Dumb AP from the wired devices connected in the main router and the same occurred.

If I ping from these wireless devices (2 Samsung Galaxy S23 Ultra) to other WiFi devices (connected into main router and dumb AP), the ping occurs normally. If these devices are connected in the main router, they can communicate with the cable connected devices normally too.

When I connect into Dumb AP via SSH, the ping from the AP and the wired devices occurs normally too. So the problem, apparently, is that in somewhere the wireless and the wired network were not totally bridge as expected.

# **Summary**

| Origin Device | Destination Device | Origin Connected Device | Destination Connected Device |Ping Result |
| -------- | -------- | -------- |-------- |-------- |
| Wireless | Wired | Dumb AP | Main Router  | 🔴 Not OK |
| Wireless | Wireless | Dumb AP | Main Router  | ✅ OK |
| Wireless | Wireless | Dumb AP | Dumb AP  | ✅ OK |
| Dumb AP | Wireless | - | Main Router  | ✅ OK |
| Wired  | Wireless | Main Router | Dumb AP | 🔴 Not OK |

### OpenWrt version

r32933-4ccb782af7

### OpenWrt release

25.12.4

### OpenWrt target/subtarget

mediatek/filogic

### Device

Cudy WR3000 v1

### Image kind

Official downloaded image

### Actual behaviour

Devices connected into Dummy AP via WiFi cannot communicate with devices connected via cable into the Main Router.

### Expected behaviour

Devices connected into Dummy AP via WiFi can communicate with devices connected via cable into the Main Router.

### Additional info

Behaviour didn't occur before upgrading from 24.10.4 to 25.12.4.

### Diffconfig

```text

```

### Terms

- [x] I am reporting an issue for OpenWrt, not an unsupported fork.

**Comment by brada4** [comment]
What do you expect closing issue you get actual responses?

**Comment by rcarvalho1990-cyber** [comment]
> What do you expect closing issue you get actual responses?

It was duplicated, created with an account that I don't use anymore. The current issue #23700 is still opened.

**Comment by brada4** [comment]
Ball is yours, I will not duplicate.

**Comment by rscarvalho90** [comment]
> Ball is yours, I will not duplicate.

I know. I've created it with an unused acccount by mistake. I did the mistake.
So, **THIS** issue is the correct one.

**Comment by rscarvalho90** [comment]
```
DNS does not use "connections" per se. 
If you run tcpdump on dns server - do you see incoming traffic from extender wifi clients?
Do you use firewall offload or bridger?
```
[issues#23699](https://github.com/openwrt/openwrt/issues/23699#issuecomment-4643634473)

Running _tcpdump_ on DNS server, it just shows ARP packets:

```
tcpdump -v host 192.168.1.5
tcpdump: listening on eth0, link-type EN10MB (Ethernet), snapshot length 262144 bytes
09:28:31.043810 ARP, Ethernet (len 6), IPv4 (len 4), Request who-has armbian tell 192.168.1.5, length 46
09:28:31.043906 ARP, Ethernet (len 6), IPv4 (len 4), Reply armbian is-at 00:15:18:XX:XX:XX (oui Unknown), length 28
09:28:31.804356 ARP, Ethernet (len 6), IPv4 (len 4), Request who-has armbian tell 192.168.1.5, length 46
09:28:31.804448 ARP, Ethernet (len 6), IPv4 (len 4), Reply armbian is-at 00:15:18:XX:XX:XX (oui Unknown), length 28
09:28:33.251310 ARP, Ethernet (len 6), IPv4 (len 4), Request who-has armbian tell 192.168.1.5, length 46
09:28:33.251395 ARP, Ethernet (len 6), IPv4 (len 4), Reply armbian is-at 00:15:18:XX:XX:XX (oui Unknown), length 28
```

Firewall is deactivated in extender. In main router, hardware flow offloading is activated. If I deactivate it, the problem still the same.

**Comment by brada4** [comment]
>  hardware flow offloading is activated. 

That is optional feature that excludes wifi roaming (actually freezes MAC on port for 60s, but in scope of fast transition it is as good as not working at all)
Switch to software offload or no offload, your "main" router can forward all ports at wire speed without offload quackery.

REF https://docs.kernel.org/networking/nf_flowtable.html#limitations

**Comment by rscarvalho90** [comment]
> > hardware flow offloading is activated.
> 
> That is optional feature that excludes wifi roaming (actually freezes MAC on port for 60s, but in scope of fast transition it is as good as not working at all) Switch to software offload or no offload, your "main" router can forward all ports at wire speed without offload quackery.
> 
> REF https://docs.kernel.org/networking/nf_flowtable.html#limitations

Apparently solved the problem. I don't know why, but before migrating to 25.12.4, hardware flow offloading was activated too and FT worked perfectly.

Thanks!

**Comment by brada4** [comment]
Cannot be, there is no material change in offload config since 24.10.0 , before that even soft offload broke roaming.

**Comment by rscarvalho90** [comment]
> > > hardware flow offloading is activated.
> > 
> > 
> > That is optional feature that excludes wifi roaming (actually freezes MAC on port for 60s, but in scope of fast transition it is as good as not working at all) Switch to software offload or no offload, your "main" router can forward all ports at wire speed without offload quackery.
> > REF https://docs.kernel.org/networking/nf_flowtable.html#limitations
> 
> Apparently solved the problem. I don't know why, but before migrating to 25.12.4, hardware flow offloading was activated too and FT worked perfectly.
> 
> Thanks!

Some minutes after I've restarted the router (I've tried to restart only firewall and nothing happened, so I had to restart the AX6000 router), the problem happened again.

**Comment by brada4** [comment]
PS offload level descriptions in luci do not reflect limitations. HW offload config item, supported or not in HW , bypasses route / fdb / arp checks, is a zip faster but totally prevents MAC address moving to other interface.

**Comment by brada4** [comment]
>  the problem happened again.

You could flussh connection tracking info `conntrack -F` - simply reloading firewall does not destroy active connection states.

**Comment by brada4** [comment]
Chase dns records with tcpdump?

**Comment by rscarvalho90** [comment]
> Chase dns records with tcpdump?

No DNS records arrived at the wired device. I have other services installed in this device and they don't work too.

```
armbian:~:# tcpdump -v host 192.168.1.5 and udp port 53
tcpdump: listening on eth0, link-type EN10MB (Ethernet), snapshot length 262144 bytes
```
The tcpdump above only worked when I moved with my smartphone next to the AX6000 router, losing the connection with the WR3000.

**Comment by brada4** [comment]
check if packets arrive interface by interface crawling from armbian to phone.....

**Comment by rscarvalho90** [comment]
> check if packets arrive interface by interface crawling from armbian to phone.....

I ran _tcpdump_ into both devices (192.168.1.1 - "Main" Router and 192.168.1.2 - Dumb AP) and found something suspicious.
Take a look:

**Router**:
``` 
root@OpenWrt_Roteador:~# tcpdump -i any host 192.168.1.5
tcpdump: WARNING: any: That device doesn't support promiscuous mode
(Promiscuous mode not supported on the "any" device)
tcpdump: verbose output suppressed, use -v[v]... for full protocol decode
listening on any, link-type LINUX_SLL2 (Linux cooked v2), snapshot length 262144 bytes
19:19:43.359174 lan2  B   ARP, Request who-has armbian.lan tell S23-Ultra-de-Rafael.lan, length 46
19:19:43.359174 br-lan B   ARP, Request who-has armbian.lan tell S23-Ultra-de-Rafael.lan, length 46
19:19:43.359572 lan4  P   ARP, Reply armbian.lan is-at 00:15:18:01:81:31 (oui Unknown), length 46
19:19:44.602776 lan2  B   ARP, Request who-has armbian.lan tell S23-Ultra-de-Rafael.lan, length 46
19:19:44.602776 br-lan B   ARP, Request who-has armbian.lan tell S23-Ultra-de-Rafael.lan, length 46
19:19:44.603174 lan4  P   ARP, Reply armbian.lan is-at 00:15:18:01:81:31 (oui Unknown), length 46
19:19:45.385088 lan2  B   ARP, Request who-has armbian.lan tell S23-Ultra-de-Rafael.lan, length 46
```

**AP**:
```
root@OpenWrt_ApSuite:~# tcpdump -i any host 192.168.1.5
tcpdump: WARNING: any: That device doesn't support promiscuous mode
(Promiscuous mode not supported on the "any" device)
tcpdump: verbose output suppressed, use -v[v]... for full protocol decode
listening on any, link-type LINUX_SLL2 (Linux cooked v2), snapshot length 262144 bytes
19:19:43.397681 phy0-ap0 B   ARP, Request who-has armbian.lan tell S23-Ultra-de-Rafael.lan, length 28
19:19:43.397697 phy1-ap0 Out ARP, Request who-has armbian.lan tell S23-Ultra-de-Rafael.lan, length 28
19:19:43.397720 phy0-ap0 Out ARP, Request who-has armbian.lan tell S23-Ultra-de-Rafael.lan, length 28
19:19:43.397728 lan1  Out ARP, Request who-has armbian.lan tell S23-Ultra-de-Rafael.lan, length 28
19:19:43.397734 eth0  Out ARP, Request who-has armbian.lan tell S23-Ultra-de-Rafael.lan, length 46
19:19:43.397744 br-lan B   ARP, Request who-has armbian.lan tell S23-Ultra-de-Rafael.lan, length 28
19:19:44.641330 phy0-ap0 B   ARP, Request who-has armbian.lan tell S23-Ultra-de-Rafael.lan, length 28
19:19:44.641340 phy1-ap0 Out ARP, Request who-has armbian.lan tell S23-Ultra-de-Rafael.lan, length 28
19:19:44.641359 phy0-ap0 Out ARP, Request who-has armbian.lan tell S23-Ultra-de-Rafael.lan, length 28
19:19:44.641367 lan1  Out ARP, Request who-has armbian.lan tell S23-Ultra-de-Rafael.lan, length 28
19:19:44.641372 eth0  Out ARP, Request who-has armbian.lan tell S23-Ultra-de-Rafael.lan, length 46
19:19:44.641378 br-lan B   ARP, Request who-has armbian.lan tell S23-Ultra-de-Rafael.lan, length 28
```

**Armbian** from router:
```
root@OpenWrt_Roteador:~# tcpdump -i any host 192.168.1.19
tcpdump: WARNING: any: That device doesn't support promiscuous mode
(Promiscuous mode not supported on the "any" device)
tcpdump: verbose output suppressed, use -v[v]... for full protocol decode
listening on any, link-type LINUX_SLL2 (Linux cooked v2), snapshot length 262144 bytes
20:23:20.500786 lan2  B   ARP, Request who-has armbian.lan tell S23-Ultra-de-Rafael.lan, length 46
20:23:20.500786 br-lan B   ARP, Request who-has armbian.lan tell S23-Ultra-de-Rafael.lan, length 46
20:23:20.501217 lan4  P   ARP, Reply armbian.lan is-at 00:15:18:XX:XX:XX (oui Unknown), length 46
20:23:21.267172 lan2  B   ARP, Request who-has armbian.lan tell S23-Ultra-de-Rafael.lan, length 46
20:23:21.267172 br-lan B   ARP, Request who-has armbian.lan tell S23-Ultra-de-Rafael.lan, length 46
20:23:21.267548 lan4  P   ARP, Reply armbian.lan is-at 00:15:18:XX:XX:XX (oui Unknown), length 46
20:23:22.744959 lan2  B   ARP, Request who-has armbian.lan tell S23-Ultra-de-Rafael.lan, length 46
20:23:22.744959 br-lan B   ARP, Request who-has armbian.lan tell S23-Ultra-de-Rafael.lan, length 46
20:23:22.745318 lan4  P   ARP, Reply armbian.lan is-at 00:15:18:XX:XX:XX (oui Unknown), length 46
```

**Notes**:
- I've turned off the Router WiFi just to be sure that my smartphone was connected into AP WiFi.
- "LAN 1" is probably the WAN port of the router.
- Armbian is connected directly in the port 4.
- AP is with only LAN 1 port connected.
- The Main Router is with **ALL** 3 LAN Ports (It has 1 WAN port and 3 LANs) connected **(!!!)**.
- AP is connected into LAN 2 port of the Router via an unmanaged switch.

**Findings**:
- ARP packets are arriving at the Router.
- ARP replies from armbian are not being brodcasted by router.
- Roter is not sending ARP packets to LAN 3 port.

**Comment by brada4** [comment]
eth0 is dsa master, it should not be br-lan member. you can verify using ip link - all external ports take form lanX@ethY (dont post, i trust your pair of eyes)

**Comment by rscarvalho90** [comment]
In router, all lan ports (lan2, lan3 and lan4)@eth0 are shown in `ip link` command whith the same attributes.

In AP occurs the same. The only difference is that lan port are lan1, lan2 and lan3.

**Comment by rscarvalho90** [comment]
**Update:**

My device has the IP fixed as Static Lease in the router.

If I spoof its MAC, assigning a random one, the new IP will be a new one in the DCHP range (192.168.1.100-250) and the communication with all devices in the network is successful.

If I fix my IP in the own device (smartphone), this only works if my MAC is spoofed, independently of which IP I use (inside or outside DCHP assignment range).

I will test duiring some period to see if this spoofed MAC will have the same problem in the next hours.

**Comment by rscarvalho90** [comment]
Packet steering was the cause. Disabling it solved the problem.
Issue closed!
