### ISSUE TITLE
No unsollicited router advertisment sent

### ISSUE THREAD

**Issue by Shakroglof** [openwrt/openwrt#22959]
### Describe the bug

On 24.10.6 the router periodically send multicast router advertisement :
```
22:44:06.860259 IP6 fe80::36ce:ff:fe37:f8c2 > ff02::1: ICMP6, router advertisement, length 120
22:45:34.130288 IP6 fe80::36ce:ff:fe37:f8c2 > ff02::1: ICMP6, router advertisement, length 120
22:48:04.298731 IP6 fe80::36ce:ff:fe37:f8c2 > ff02::1: ICMP6, router advertisement, length 120
```

But on 25.12.2 router advertisements are only sent in response to a router solicitation  :
```
21:37:02.936960 IP6 fe80::b622:ff:fe92:4d60 > ff02::2: ICMP6, router solicitation, length 8                           
21:37:02.939352 IP6 fe80::36ce:ff:fe37:f8c2 > fe80::b622:ff:fe92:4d60: ICMP6, router advertisement, length 120        
21:39:34.120443 IP6 fe80::b622:ff:fe92:4d60 > ff02::2: ICMP6, router solicitation, length 8                           
21:39:34.123642 IP6 fe80::36ce:ff:fe37:f8c2 > fe80::b622:ff:fe92:4d60: ICMP6, router advertisement, length 120        
21:44:45.247272 IP6 fe80::5cb5:339f:cb4:618b > ff02::2: ICMP6, router solicitation, length 8                          
21:44:45.249543 IP6 fe80::36ce:ff:fe37:f8c2 > fe80::5cb5:339f:cb4:618b: ICMP6, router advertisement, length 120       
21:48:39.694753 IP6 fe80::5cb5:339f:cb4:618b > ff02::2: ICMP6, router solicitation, length 8                          
21:48:39.697103 IP6 fe80::36ce:ff:fe37:f8c2 > fe80::5cb5:339f:cb4:618b: ICMP6, router advertisement, length 120
```

Because no periodic router advertisements are sent from OpenWRT 25.12.2, one of my host (a FreeBSD host) considers the address prefix invalid and delete its global address from its interface, keeping only the linklocal address :
```
root@jesus:~ # ifconfig re0
re0: flags=1008843<UP,BROADCAST,RUNNING,SIMPLEX,MULTICAST,LOWER_UP> metric 0 mtu 1500                                 
        options=8209b<RXCSUM,TXCSUM,VLAN_MTU,VLAN_HWTAGGING,VLAN_HWCSUM,WOL_MAGIC,LINKSTATE>                          
        ether 20:cf:30:e2:e9:eb
        inet 192.168.10.214 netmask 0xffffff00 broadcast 192.168.10.255
        inet6 fe80::22cf:30ff:fee2:e9eb%re0 prefixlen 64 scopeid 0x1
        inet6 2a02:xxxx:xxxx:2110:22cf:30ff:fee2:e9eb prefixlen 64 autoconf pltime 209 vltime 209
        media: Ethernet autoselect (1000baseT <full-duplex>)
        status: active
        nd6 options=23<PERFORMNUD,ACCEPT_RTADV,AUTO_LINKLOCAL>
root@jesus:~ # ifconfig re0
re0: flags=1008843<UP,BROADCAST,RUNNING,SIMPLEX,MULTICAST,LOWER_UP> metric 0 mtu 1500
        options=8209b<RXCSUM,TXCSUM,VLAN_MTU,VLAN_HWTAGGING,VLAN_HWCSUM,WOL_MAGIC,LINKSTATE>
        ether 20:cf:30:e2:e9:eb
        inet 192.168.10.214 netmask 0xffffff00 broadcast 192.168.10.255
        inet6 fe80::22cf:30ff:fee2:e9eb%re0 prefixlen 64 scopeid 0x1
        media: Ethernet autoselect (1000baseT <full-duplex>)
        status: active
        nd6 options=23<PERFORMNUD,ACCEPT_RTADV,AUTO_LINKLOCAL>
```

### OpenWrt version

r32802-f505120278

### OpenWrt release

25.12.2

### OpenWrt target/subtarget

ramips/mt7621

### Device

Xiaomi Mi Router 3 Pro

### Image kind

Official downloaded image

### Steps to reproduce

Upgrade to 25.12.2 and run tcpdump

### Actual behaviour

No periodic router advertisements are sent to the multicast address ff02::1

### Expected behaviour

Router advertisements sent to ff02::1 should be sent before the prefix lifetime expire 

### Diffconfig

```text

```

### Terms

- [x] I am reporting an issue for OpenWrt, not an unsupported fork.

**Comment by brada4** [comment]
DUP https://github.com/openwrt/openwrt/issues/22785

https://datatracker.ietf.org/doc/html/rfc7084 G-5 MUST non-compliant. Again. 

Send in the circus

**Comment by Shakroglof** [comment]
I'd say it's more specific to this part of rfc4862 :

> [5.5.1](https://datatracker.ietf.org/doc/html/rfc4862#section-5.5.1).  Soliciting Router Advertisements
> 
>    Router Advertisements are sent periodically to the all-nodes
>    multicast address.

**Comment by Shakroglof** [comment]
Hi,
Any chance this regression is corrected before 24.10 support ends?
