### ISSUE TITLE
postrouting SNAT doesn't work

### ISSUE THREAD

**Issue by WeSTManCoder** [openwrt/openwrt#10097]
root@OpenWrt:~# tcpdump -n -i br-lan port 53 or port 54
tcpdump: verbose output suppressed, use -v or -vv for full protocol decode
listening on br-lan, link-type EN10MB (Ethernet), capture size 262144 bytes
20:42:16.008262 IP 192.168.1.100.29462 > 192.168.1.1.53: 27030+ A? www.google.ru. (31)
20:42:16.015883 IP 192.168.1.1.54 > 192.168.1.100.29462: UDP, length 47
20:42:16.660565 IP 192.168.1.100.1028 > 192.168.1.1.53: 9723+ A? aa.google.com. (31)
20:42:16.680901 IP 192.168.1.1.54 > 192.168.1.100.1028: UDP, length 68
20:42:20.812799 IP 192.168.1.100.1029 > 192.168.1.1.53: 7068+ A? ogs.google.ru. (31)
20:42:20.840368 IP 192.168.1.1.54 > 192.168.1.100.1029: UDP, length 158

nft list ruleset:
table ip my_postrouting {
        chain my_snat {
                type nat hook postrouting priority srcnat; policy accept;
                udp sport 54 snat to 192.168.1.1:53
        }
}

Not working SNAT firewall4

Linux OpenWrt 5.10.120 #0 SMP Sun Jun 19 10:40:30 2022 mips GNU/Linux
OpenWrt SNAPSHOT r19859-36e46c3c13 / LuCI Master git-22.167.28356-8effea5

Firewall4 last updated on openwrt master
please fix this problem, thanks
