### ISSUE TITLE
odhcpd reports no default IPv6 route and sets RA lifetime to 0 even when a default route is present

### ISSUE THREAD

**Issue by dhrm1k** [openwrt/openwrt#23246]
### Describe the bug

odhcpd repeatedly reports that no IPv6 default route is present and sets RA lifetime to 0, even though the system has a working IPv6 default route over a WireGuard interface.

On this VM:
- ip -6 route shows `default dev tb29231R64 proto static metric 1`
- ifstatus tb29231R64 shows the interface is up and has a `::/0` route
- IPv6 connectivity over that interface works
- /proc/net/ipv6_route also contains the `::/0` entry for the same interface

Despite that, odhcpd logs:
No default route present, setting ra_lifetime to 0!

It also emits send failures on LAN while doing so.

### OpenWrt version

r28959-29397011cc

### OpenWrt release

24.10.4

### OpenWrt target/subtarget

x86/64

### Device

VM

### Image kind

Official downloaded image

### Steps to reproduce

1. Boot OpenWrt 24.10.4 on x86/64.
2. Configure IPv6 upstream over a WireGuard interface.
3. Ensure the system has an IPv6 default route via that interface.
4. Keep odhcpd enabled on LAN.
5. Observe logs and route/interface state with:

   ip -6 route
   ifstatus tb29231R64
   logread | grep odhcpd

### Actual behaviour

odhcpd repeatedly logs:

daemon.warn odhcpd[2169]: No default route present, setting ra_lifetime to 0!

and also emits:

daemon.err odhcpd[2169]: Failed to send to ff02::1%lan@br-lan (Network unreachable)
daemon.err odhcpd[2169]: Failed to send to ff02::1%lan@br-lan (Address not available)

At the same time, the system state shows a working IPv6 default route:

2a11:6c7:f07:15e::/64 dev tb29231R64 proto kernel metric 256 pref medium
unreachable fd9f:c7fd:4ea8::/48 dev lo proto static metric 2147483647 pref medium
fe80::/64 dev eth0 proto kernel metric 256 pref medium
fe80::/64 dev br-lan proto kernel metric 256 pref medium
default dev tb29231R64 proto static metric 1 pref medium

ifstatus tb29231R64 also shows:

{
  "up": true,
  "l3_device": "tb29231R64",
  "proto": "wireguard",
  "ipv6-address": [
    {
      "address": "2a11:6c7:f07:15e::2",
      "mask": 64
    }
  ],
  "route": [
    {
      "target": "::",
      "mask": 0,
      "nexthop": "::",
      "metric": 1,
      "source": "::/0"
    }
  ]
}

IPv6 reachability over the interface also works:

ping -6 -I tb29231R64 -c 2 2606:4700:4700::1111
ping -6 -I tb29231R64 -c 2 2001:4860:4860::8888

Both succeeded with 0% packet loss.

### Expected behaviour

If a valid IPv6 default route is present and usable, odhcpd should detect it and should not set RA lifetime to 0 for that reason.

### Additional info

/proc/net/ipv6_route also contains the `::/0` entry for the same WireGuard interface:

5:00000000000000000000000000000000 00 00000000000000000000000000000000 00 00000000000000000000000000000000 00000001 00000002 00000000 00000001 tb29231R64

This looks like a mismatch between:
- kernel IPv6 route state
- interface status
- odhcpd route detection / RA lifetime handling

It may be specific to IPv6 upstream carried over WireGuard or to a transient state during LAN/interface events.

### Diffconfig

```text
N/A
```

### Terms

- [x] I am reporting an issue for OpenWrt, not an unsupported fork.

**Comment by egc112** [comment]
Default routing via IPv6 e.g. of WireGuard interfaces needs some special tricks.
Did you disable source routing of IPv6 on wan6 interface?
Or use a workaround like adding to Allowed IPs `8000::/1, ::0/1`

Do a `service network restart` after changing

Furthermore you are running an old build 24.10.6 is latest 24.10 but will be EOL in a couple of months. Consider upgrading to 25.12.3

**Comment by dhrm1k** [comment]
Thanks, that helped. I tested both suggestions on the VM here.

I tried:

- disabling IPv6 source routing on `wan6` with `sourcefilter='0'`
- replacing WireGuard `AllowedIPs '::/0'` with:
  - `::/1`
  - `8000::/1`

In both cases, `odhcpd` still logged:

```text
No default route present, setting ra_lifetime to 0!
```

For the split-AllowedIPs case, the route state changed as expected. The VM
ended up with:

```text
::/1 dev tb29231R64 proto static metric 1
8000::/1 dev tb29231R64 proto static metric 1
```

and `ifstatus tb29231R64` showed the two split routes as well, but the
warning still remained.

So at least on this x86 VM, neither of those WireGuard routing changes
made `odhcpd` recognize the IPv6 default routing state.

**Comment by egc112** [comment]
OK I looked into it and checked my notes.
The odhcpd warning is normal, it is confused as there is no nexthop in the default route via the VPN as that is not needed.
Despite the warning everything should work anyway and if not the problem lies elsewhere.
To let odhcpd always announce the default route add to:
/etc/config/dhcp:
```
config dhcp 'lan'
    option ra_default '2'
```

0 = never announce default route
1 = announce if default route exists
2 = always announce

But again this will get rid of the warning but if you did not have an ipv6 route via the VPN already then this will not help.

See my notes about how I setup a WireGuard client:
[WireGuard Client Setup Guide](https://raw.githubusercontent.com/egc112/OpenWRT-egc-add-on/main/notes/OpenWRT%20WireGuard%20Client%20Setup%20guide%20using%20LuCi.pdf)

**Comment by bol-van** [comment]
I'm running self-compiled 25.12.4. Compiled and installed latest odhcpd 

```
opkg list-installed odhcpd-ipv6only
odhcpd-ipv6only - 2026.06.28~68f38269-r1
```

After restart of odhcpd it sends RA with default router lifetime 600 sec immediately.
Then it may send it 2 more times after timeout.
But then it stops and hosts lose default route.

```
service odhcpd restart
14:21:56.884159 IP6 fe80::openwrt > ff02::1: ICMP6, router advertisement, length 192
14:21:56.884247 IP6 fe80::openwrt > ff02::1: ICMP6, router advertisement, length 96
14:22:12.883527 IP6 fe80::openwrt > ff02::1: ICMP6, router advertisement, length 192
14:22:12.883641 IP6 fe80::openwrt > ff02::1: ICMP6, router advertisement, length 96
14:22:28.883904 IP6 fe80::openwrt > ff02::1: ICMP6, router advertisement, length 192
14:22:28.884025 IP6 fe80::openwrt > ff02::1: ICMP6, router advertisement, length 96
^C
<NO RAs WILL BE SENT ANYMORE>
```

Old odhcpd (may be 24.x or 23.x) works fine.

```
service odhcpd restart
14:28:25.593524 IP6 fe80::fe80::openwrt > ff02::1: ICMP6, router advertisement, length 192
14:28:36.525560 IP6 fe80::fe80::openwrt > ff02::1: ICMP6, router advertisement, length 96
14:28:41.593461 IP6 fe80::fe80::openwrt > ff02::1: ICMP6, router advertisement, length 192
14:28:52.527225 IP6 fe80::fe80::openwrt > ff02::1: ICMP6, router advertisement, length 96
14:29:22.303565 IP6 fe80::fe80::openwrt > ff02::1: ICMP6, router advertisement, length 192
14:29:42.087780 IP6 fe80::fe80::openwrt > ff02::1: ICMP6, router advertisement, length 96
14:29:56.600882 IP6 fe80::fe80::openwrt > ff02::1: ICMP6, router advertisement, length 192
14:30:39.395550 IP6 fe80::fe80::openwrt > ff02::1: ICMP6, router advertisement, length 96
14:30:41.236452 IP6 fe80::fe80::openwrt > ff02::1: ICMP6, router advertisement, length 192
14:31:09.566531 IP6 fe80::fe80::openwrt > ff02::1: ICMP6, router advertisement, length 192
<RAs WILL BE SENT INDEFINITELY>
```

in /etc/config/dhcp
```
config odhcpd 'odhcpd'
        option loglevel '4'
        option piodir '/tmp/odhcpd-piodir'
        option hostsdir '/tmp/hosts'
```
