### ISSUE TITLE
Strange DNS issues on Raspberry Pi CM4

### ISSUE THREAD

**Issue by micw** [openwrt/openwrt#19478]
### Describe the bug

DNS Requests seems not to reach dnsmasq in some cases.

I have OpenWRT instaleld on the compute module. Clean fresh setup, nothing configured (except IP address, standard gateway and external DNS).

On my linux box I have the OpenWRT address in /etc/resolv.conf. I can do nslookup google.com which always succeeds. On the OpenWRT box I see with tcpdump:

16:58:25.440052 IP 192.168.1.9.47025 > 192.168.1.210.53: 32628+ A? [google.com](http://google.com/). (28)
16:58:25.440558 IP 192.168.1.210.53 > 192.168.1.9.47025: 32628 1/0/0 A 142.250.186.174 (44)
16:58:25.441025 IP 192.168.1.9.43227 > 192.168.1.210.53: 35148+ AAAA? [google.com](http://google.com/). (28)
16:58:25.441392 IP 192.168.1.210.53 > 192.168.1.9.43227: 35148 1/0/0 AAAA 2a00:1450:4001:831::200e

But when I do "ping google.com" or "curl google.com", DNS resolving almost always fails. On the OpenWRT box I see with tcpdump:
16:58:57.890957 IP 192.168.1.9.50633 > 192.168.1.210.53: 124+ A? [google.com](http://google.com/). (56)

(but no response).

In the dnsmasq log I also see only the queries with "nslookup".

### OpenWrt version

r28739-d9340319c6

### OpenWrt release

24.10.2

### OpenWrt target/subtarget

bcm27xx/bcm2711

### Device

Raspberry Pi CM4 on I/O Board

### Image kind

Official downloaded image

### Steps to reproduce

* Fresh install of OpenWRT on CM4 (i use the ext4 factory image if that maters)
* Set up IP, Standard Gateway and DNS
* install tcpdump and run `tcpdump -i br-lan port 53 -n`
* on a linux box the OPenWRT box as nameserver in /etc/resolv.conf
* on the linux box run `nslookup google.com` and `ping google.com`

I have no idea why the first works but the second not. But I see that the DNS queries from the second are larger than the first.

### Actual behaviour

On the linux box: 
`nslookup google.com` always gets the IP
`ping google.com` fails in most cases with "ping: google.de: Temporary failure in name resolution"

### Expected behaviour

`ping google.com` should also get an answer from dnsmasq

### Additional info

Tested on multiple carrier boards for cm4.

### Diffconfig

```text

```

### Terms

- [x] I am reporting an issue for OpenWrt, not an unsupported fork.

**Comment by micw** [comment]
I stopped dnsmasq on the device and run netcat `nc -l -p 53 -u` on that device. The dns requests (when I do ping google.com) do not even reach there. So for some reason the UDP packages get lost.

**Comment by micw** [comment]
I also flushed the nft  ruleset to ensure that it's not a wired firewall rule. Still the same behavior

**Comment by micw** [comment]
I see large numbers of dropped packages on the ethernet bridge:

```

br-lan    Link encap:Ethernet  HWaddr E4:5F:01:CF:88:AB  
          inet addr:192.168.1.1  Bcast:192.168.1.255  Mask:255.255.255.0
          inet6 addr: fe80::e65f:1ff:fecf:88ab/64 Scope:Link
          inet6 addr: fd93:ed22:8934::1/60 Scope:Global
          UP BROADCAST RUNNING MULTICAST  MTU:1500  Metric:1
          RX packets:7756 errors:0 dropped:1690 overruns:0 frame:0
          TX packets:1746 errors:0 dropped:0 overruns:0 carrier:0
          collisions:0 txqueuelen:1000 
          RX bytes:1736873 (1.6 MiB)  TX bytes:247890 (242.0 KiB)

eth0      Link encap:Ethernet  HWaddr E4:5F:01:CF:88:AB  
          UP BROADCAST RUNNING MULTICAST  MTU:1500  Metric:1
          RX packets:17261 errors:0 dropped:0 overruns:0 frame:0
          TX packets:1751 errors:0 dropped:0 overruns:0 carrier:0
          collisions:0 txqueuelen:1000 
          RX bytes:2851421 (2.7 MiB)  TX bytes:248244 (242.4 KiB)


```

Edit: same on eth0 when removing the bridge

**Comment by brada4** [comment]
What do you mean by "same behaviour" when you say it sometimes resolves?

**Comment by bcb2000** [comment]
I have experienced similar on Raspberry Pi (bcm27xx/bcm2709) with images from 24.10.1 onwards.  23.05.6 and earlier do not have this problem. _Edit_ - to be a little more specific, the first release in which the issue is reproducible is 24.10.0-rc1, and it is still reproducible in 25.12.0-rc1.

To debug this, I have created a test setup as follows:
- Raspberry Pi 3 with OpenWRT.  LAN and WAN interfaces configured on vlans.
- Raspberry Pi 4 with Raspberry Pi OS trixie as a test client connected to the LAN vlan.

Note that this issue can only be reproduced when the client is dual stack IPv4+IPv6.  I created this scenario by adding a manual ipv6 address to the client: `nmcli c m 'Wired connection 1' ip6.method manual ip6 2::/64; nmcli c r; nmcli c u 'Wired connection 1'`.  It doesn't matter that the client's IPv6 network won't actually work.

I ran tcpdump on the client, on the openwrt server, and on a mirrored port on the network.  This was necessary because in the failure mode, the packets traced by the client do not match those traced at the server.

At a high level, what is happening is:
The client is producing two UDP DNS query packets (A and AAAA) with the same ID, more or less simultaneously.
The two packets traverse the network independently
The two packets are merged in the OpenWRT network stack and tcpdump reports them having arrived with a bad checksum.

client trace
```
$ tcpdump -i bond0.1000 -n -s0 -vv -XX host 10.214.0.10 and udp port 53
tcpdump: listening on bond0.1000, link-type EN10MB (Ethernet), snapshot length 262144 bytes
17:42:20.269949 IP (tos 0x0, ttl 64, id 25334, offset 0, flags [DF], proto UDP (17), length 55)
    10.214.0.10.49959 > 10.214.0.1.53: [bad udp cksum 0x15eb -> 0x8c60!] 23110+ A? mini7.lan. (27)
        0x0000:  d83a dd01 12cd 6200 6a5a 8d39 0800 4500  .:....b.jZ.9..E.
        0x0010:  0037 62f6 4000 4011 c209 0ad6 000a 0ad6  .7b.@.@.........
        0x0020:  0001 c327 0035 0023 15eb 5a46 0100 0001  ...'.5.#..ZF....
        0x0030:  0000 0000 0000 056d 696e 6937 036c 616e  .......mini7.lan
        0x0040:  0000 0100 01                             .....
17:42:20.269957 IP (tos 0x0, ttl 64, id 25335, offset 0, flags [DF], proto UDP (17), length 55)
    10.214.0.10.49959 > 10.214.0.1.53: [bad udp cksum 0x15eb -> 0xa866!] 9024+ AAAA? mini7.lan. (27)
        0x0000:  d83a dd01 12cd 6200 6a5a 8d39 0800 4500  .:....b.jZ.9..E.
        0x0010:  0037 62f7 4000 4011 c208 0ad6 000a 0ad6  .7b.@.@.........
        0x0020:  0001 c327 0035 0023 15eb 2340 0100 0001  ...'.5.#..#@....
        0x0030:  0000 0000 0000 056d 696e 6937 036c 616e  .......mini7.lan
        0x0040:  0000 1c00 01                             .....
^C
2 packets captured
```

network trace
```
$ tcpdump -i enxc8a362d8485c -n -s0 -vv -XX host 10.214.0.10 and udp port 53
tcpdump: listening on enxc8a362d8485c, link-type EN10MB (Ethernet), snapshot length 262144 bytes
17:42:20.270074 IP (tos 0x0, ttl 64, id 25334, offset 0, flags [DF], proto UDP (17), length 55)
    10.214.0.10.49959 > 10.214.0.1.53: [udp sum ok] 23110+ A? mini7.lan. (27)
        0x0000:  d83a dd01 12cd 6200 6a5a 8d39 8100 03e8  .:....b.jZ.9....
        0x0010:  0800 4500 0037 62f6 4000 4011 c209 0ad6  ..E..7b.@.@.....
        0x0020:  000a 0ad6 0001 c327 0035 0023 8c60 5a46  .......'.5.#.`ZF
        0x0030:  0100 0001 0000 0000 0000 056d 696e 6937  ...........mini7
        0x0040:  036c 616e 0000 0100 01                   .lan.....
17:42:20.270077 IP (tos 0x0, ttl 64, id 25335, offset 0, flags [DF], proto UDP (17), length 55)
    10.214.0.10.49959 > 10.214.0.1.53: [udp sum ok] 9024+ AAAA? mini7.lan. (27)
        0x0000:  d83a dd01 12cd 6200 6a5a 8d39 8100 03e8  .:....b.jZ.9....
        0x0010:  0800 4500 0037 62f7 4000 4011 c208 0ad6  ..E..7b.@.@.....
        0x0020:  000a 0ad6 0001 c327 0035 0023 a866 2340  .......'.5.#.f#@
        0x0030:  0100 0001 0000 0000 0000 056d 696e 6937  ...........mini7
        0x0040:  036c 616e 0000 1c00 01                   .lan.....
^C
2 packets captured
```

server (openwrt) trace
```
$ tcpdump -i eth0.1000 -n  -s0 -vv -XX host 10.214.0.10 and udp port 53
tcpdump: listening on eth0.1000, link-type EN10MB (Ethernet), snapshot length 262144 bytes
17:42:20.280355 IP (tos 0x0, ttl 64, id 25334, offset 0, flags [DF], proto UDP (17), length 82)
    10.214.0.10.49959 > 10.214.0.1.53: [bad udp cksum 0x8c60 -> 0x5dac!] 23110+ A? mini7.lan. (54)
        0x0000:  d83a dd01 12cd 6200 6a5a 8d39 0800 4500  .:....b.jZ.9..E.
        0x0010:  0052 62f6 4000 4011 c1ee 0ad6 000a 0ad6  .Rb.@.@.........
        0x0020:  0001 c327 0035 003e 8c60 5a46 0100 0001  ...'.5.>.`ZF....
        0x0030:  0000 0000 0000 056d 696e 6937 036c 616e  .......mini7.lan
        0x0040:  0000 0100 0123 4001 0000 0100 0000 0000  .....#@.........
        0x0050:  0005 6d69 6e69 3703 6c61 6e00 001c 0001  ..mini7.lan.....
^C
1 packet captured
```

Other aspects to this:

- I found if the openwrt on the server is on a different subnet, and the UDP packets are routed through a separate router, they remain separate and the target server is able to respond to both queries (this is my current workaround for the issue).
- I also observed that wlan clients on the same subnet as the openwrt router do not experience the issue described.  Additional info: the physical network is made up of ubiquiti access points and switches.
- I was not able to reproduce the issue on other hardware - I have tried ipq40xx/generic
- On IPv6 stack, this issue does not occur - however the behaviour is similar to what I traced above on IPv4.  The A and AAAA queries arrive 'merged' into one UDP packet at OpenWRT, but the server responds in individual UDP messages back to the client.  (I'm not sharing the tcpdump trace for this, it's full of my public IPv6 addresses)

**Comment by bcb2000** [comment]
I have performed further tests to try to identify the specific circumstances where the issue arises.

Additional targets and hardware tested (with 25.12.0-rc1)
* the issue is reproducible in bcm2709 on raspberry pi 4B and 3B+ devices but not on a 3B device
* the issue is reproducible in bcm2710 on a raspberry pi 3B+ device but not on a 3B device
* the issue is reproducible in bcm2711 on a raspberry pi 4B device

Additional tests performed
* I copied the 23.05.5 kernel on to a device flashed with 25.12.0-rc1.  This broke a lot of other functionality but it was stable enough to test this issue - the issue was not reproducible with the older kernel
* I installed a USB network adapter (ASIX AX88179B - kmod-usb-net-asix-ax88179) and switched all eth0 configuration over to eth1 - this issue was not reproducible on DNS queries via the USB adapter.

**Comment by bcb2000** [comment]
Just found this issue: https://github.com/openwrt/openwrt/issues/16261 and related [forum posting](https://forum.openwrt.org/t/bizarre-dns-problems-with-debian-linux-after-upgrade-to-24-10/225860/43) 

same mitigation:
`ethtool -K eth0 rx-gro-list off`
temporarily resolves the issue

To make the fix permanent across reboots, I have added this to `/etc/config/network`
```
config device
        option name 'eth0'
        option gro '0'
````

**Comment by micw** [comment]
@bcb2000 Thank you, this is very helpful!

I wonder why the issue is otherwise ignored by the OpenWRT team

Edit: I think `option gro '0'` completely disables offloading while this issue is only in `rx-gro-list`. So the permanent fix comes with a larger performance degradation that would be required.
